{
  "schema_version": 1,
  "layer": "aoa-evals",
  "source_of_truth": {
    "eval_catalog": "generated/eval_catalog.min.json",
    "runtime_evidence_selection_examples": "mechanics/audit/parts/selected-evidence-packets/examples/runtime_evidence_selection.*.example.json",
    "artifact_to_verdict_hook_examples": [
      "mechanics/audit/parts/artifact-verdict-hooks/examples/artifact_to_verdict_hook.*.example.json",
      "mechanics/checkpoint/parts/a2a-summon-return/examples/artifact_to_verdict_hook.*.example.json",
      "mechanics/checkpoint/parts/restartable-inquiry/examples/artifact_to_verdict_hook.*.example.json",
      "mechanics/checkpoint/parts/self-agent-posture/examples/artifact_to_verdict_hook.*.example.json"
    ]
  },
  "templates": [
    {
      "template_kind": "artifact_to_verdict_hook",
      "template_name": "aoa-p-0006-approval-boundary-hook",
      "playbook_id": "AOA-P-0006",
      "eval_anchor": "aoa-approval-boundary-adherence",
      "verdict_bundle_ref": "repo:aoa-evals/evals/boundary/aoa-approval-boundary-adherence/EVAL.md",
      "required_runtime_artifacts": [
        "approval_record",
        "rollback_marker",
        "health_check",
        "improvement_log"
      ],
      "review_required": true,
      "source_example_ref": "mechanics/checkpoint/parts/self-agent-posture/examples/artifact_to_verdict_hook.self-agent-checkpoint-rollout.example.json"
    },
    {
      "template_kind": "artifact_to_verdict_hook",
      "template_name": "aoa-p-0008-tool-trajectory-hook",
      "playbook_id": "AOA-P-0008",
      "eval_anchor": "aoa-tool-trajectory-discipline",
      "verdict_bundle_ref": "repo:aoa-evals/evals/workflow/aoa-tool-trajectory-discipline/EVAL.md",
      "required_runtime_artifacts": [
        "route_decision",
        "bounded_plan",
        "verification_result",
        "transition_decision",
        "distillation_pack"
      ],
      "review_required": true,
      "source_example_ref": "mechanics/audit/parts/artifact-verdict-hooks/examples/artifact_to_verdict_hook.long-horizon-model-tier-orchestra.example.json"
    },
    {
      "template_kind": "artifact_to_verdict_hook",
      "template_name": "aoa-p-0009-long-horizon-depth-hook",
      "playbook_id": "AOA-P-0009",
      "eval_anchor": "aoa-long-horizon-depth",
      "verdict_bundle_ref": "repo:aoa-evals/evals/workflow/aoa-long-horizon-depth/EVAL.md",
      "required_runtime_artifacts": [
        "inquiry_checkpoint",
        "decision_ledger",
        "contradiction_map",
        "memory_delta",
        "canon_delta",
        "next_pass_brief"
      ],
      "review_required": true,
      "source_example_ref": "mechanics/checkpoint/parts/restartable-inquiry/examples/artifact_to_verdict_hook.restartable-inquiry-loop.example.json"
    },
    {
      "template_kind": "artifact_to_verdict_hook",
      "template_name": "aoa-p-0014-verification-honesty-hook",
      "playbook_id": "AOA-P-0014",
      "eval_anchor": "aoa-verification-honesty",
      "verdict_bundle_ref": "repo:aoa-evals/evals/workflow/aoa-verification-honesty/EVAL.md",
      "required_runtime_artifacts": [
        "startup_canon_map",
        "preview_evidence",
        "blocker_list",
        "verification_pack",
        "shareable_summary"
      ],
      "review_required": true,
      "source_example_ref": "mechanics/audit/parts/artifact-verdict-hooks/examples/artifact_to_verdict_hook.local-stack-diagnosis.example.json"
    },
    {
      "template_kind": "artifact_to_verdict_hook",
      "template_name": "aoa-p-0018-scope-drift-hook",
      "playbook_id": "AOA-P-0018",
      "eval_anchor": "aoa-scope-drift-detection",
      "verdict_bundle_ref": "repo:aoa-evals/evals/boundary/aoa-scope-drift-detection/EVAL.md",
      "required_runtime_artifacts": [
        "failure_map",
        "boundary_map",
        "remediation_change_set",
        "revalidation_pack",
        "remediation_decision",
        "handoff_record"
      ],
      "review_required": true,
      "source_example_ref": "mechanics/audit/parts/artifact-verdict-hooks/examples/artifact_to_verdict_hook.validation-driven-remediation.example.json"
    },
    {
      "template_kind": "artifact_to_verdict_hook",
      "template_name": "aoa-p-0031-a2a-summon-return-checkpoint-hook",
      "playbook_id": "AOA-P-0031",
      "eval_anchor": "aoa-a2a-summon-return-checkpoint",
      "verdict_bundle_ref": "repo:aoa-evals/evals/workflow/aoa-a2a-summon-return-checkpoint/EVAL.md",
      "required_runtime_artifacts": [
        "summon_request",
        "summon_decision",
        "codex_local_target",
        "child_task_result",
        "return_plan",
        "checkpoint_bridge_plan",
        "a2a_return_eval_packet",
        "memo_writeback_ref",
        "runtime_closeout_dry_run_receipt"
      ],
      "review_required": true,
      "source_example_ref": "mechanics/checkpoint/parts/a2a-summon-return/examples/artifact_to_verdict_hook.a2a-summon-return-checkpoint.example.json"
    },
    {
      "template_kind": "artifact_to_verdict_hook",
      "template_name": "trace-integrity-chaos",
      "playbook_id": "AOA-P-0032",
      "eval_anchor": "aoa-witness-trace-integrity",
      "verdict_bundle_ref": "repo:aoa-evals/evals/workflow/aoa-witness-trace-integrity/EVAL.md",
      "required_runtime_artifacts": [
        "runtime_stress_lane",
        "runtime_reentry_gate",
        "owner_runtime_receipt",
        "runtime_closeout_receipt",
        "regrounding_ticket_ref",
        "proof_handoff_candidate"
      ],
      "review_required": true,
      "source_example_ref": "mechanics/audit/parts/artifact-verdict-hooks/examples/artifact_to_verdict_hook.trace-integrity-chaos.example.json"
    },
    {
      "template_kind": "runtime_evidence_selection",
      "template_name": "phase-alpha-memo-contradiction-gap-v1",
      "playbook_id": null,
      "eval_anchor": "aoa-memo-contradiction-integrity",
      "verdict_bundle_ref": "repo:aoa-evals/evals/workflow/aoa-memo-contradiction-integrity/EVAL.md",
      "required_runtime_artifacts": [
        "summary",
        "case-breakdown",
        "environment-note",
        "integrity-sidecar"
      ],
      "review_required": true,
      "source_example_ref": "mechanics/audit/parts/selected-evidence-packets/examples/runtime_evidence_selection.phase-alpha-memo-contradiction-gap.example.json"
    },
    {
      "template_kind": "runtime_evidence_selection",
      "template_name": "phase-alpha-memo-contradiction-rerun-v1",
      "playbook_id": null,
      "eval_anchor": "aoa-memo-contradiction-integrity",
      "verdict_bundle_ref": "repo:aoa-evals/evals/workflow/aoa-memo-contradiction-integrity/EVAL.md",
      "required_runtime_artifacts": [
        "summary",
        "case-breakdown",
        "environment-note",
        "integrity-sidecar"
      ],
      "review_required": true,
      "source_example_ref": "mechanics/audit/parts/selected-evidence-packets/examples/runtime_evidence_selection.phase-alpha-memo-contradiction-rerun.example.json"
    },
    {
      "template_kind": "runtime_evidence_selection",
      "template_name": "phase-alpha-memo-recall-rerun-v1",
      "playbook_id": null,
      "eval_anchor": "aoa-memo-recall-integrity",
      "verdict_bundle_ref": "repo:aoa-evals/evals/workflow/aoa-memo-recall-integrity/EVAL.md",
      "required_runtime_artifacts": [
        "summary",
        "case-breakdown",
        "environment-note",
        "integrity-sidecar"
      ],
      "review_required": true,
      "source_example_ref": "mechanics/audit/parts/selected-evidence-packets/examples/runtime_evidence_selection.phase-alpha-memo-recall-rerun.example.json"
    },
    {
      "template_kind": "runtime_evidence_selection",
      "template_name": "phase-alpha-memo-writeback-act-v1",
      "playbook_id": null,
      "eval_anchor": "aoa-memo-writeback-act-integrity",
      "verdict_bundle_ref": "repo:aoa-evals/evals/workflow/aoa-memo-writeback-act-integrity/EVAL.md",
      "required_runtime_artifacts": [
        "summary",
        "case-breakdown",
        "environment-note",
        "integrity-sidecar"
      ],
      "review_required": true,
      "source_example_ref": "mechanics/audit/parts/selected-evidence-packets/examples/runtime_evidence_selection.phase-alpha-memo-writeback-act.example.json"
    },
    {
      "template_kind": "runtime_evidence_selection",
      "template_name": "return-anchor-integrity-wrapper-v1",
      "playbook_id": null,
      "eval_anchor": "aoa-return-anchor-integrity",
      "verdict_bundle_ref": "repo:aoa-evals/evals/workflow/aoa-return-anchor-integrity/EVAL.md",
      "required_runtime_artifacts": [
        "summary",
        "case-breakdown",
        "environment-note",
        "integrity-sidecar"
      ],
      "review_required": true,
      "source_example_ref": "mechanics/audit/parts/selected-evidence-packets/examples/runtime_evidence_selection.return-anchor-integrity.example.json"
    },
    {
      "template_kind": "runtime_evidence_selection",
      "template_name": "runtime-chaos-window",
      "playbook_id": null,
      "eval_anchor": "aoa-stress-recovery-window",
      "verdict_bundle_ref": "repo:aoa-evals/evals/comparison/longitudinal-window/aoa-stress-recovery-window/EVAL.md",
      "required_runtime_artifacts": [
        "summary",
        "case-breakdown",
        "environment-note",
        "integrity-sidecar"
      ],
      "review_required": true,
      "source_example_ref": "mechanics/audit/parts/selected-evidence-packets/examples/runtime_evidence_selection.runtime-chaos-window.example.json"
    },
    {
      "template_kind": "runtime_evidence_selection",
      "template_name": "workhorse-q4-vs-q6-latency-tradeoff",
      "playbook_id": null,
      "eval_anchor": null,
      "verdict_bundle_ref": null,
      "required_runtime_artifacts": [
        "summary",
        "environment-note",
        "comparison-note"
      ],
      "review_required": true,